{
  "object_id": "aos:promotion:GatePromotionRecord:aos-p2-conditional",
  "object_kind": "GatePromotionRecord",
  "promotion_id": "AOS-PROMOTE-1-001",
  "target_class": "P2",
  "gate_assessment_refs": [
    "docs/governance/audits/aos/aos-promote/aos-promotion-gate-matrix.json",
    "docs/governance/audits/aos/aos-promote/aos-promote-readiness-audit.md"
  ],
  "deferred_gap_acceptance_refs": [
    "docs/governance/audits/aos/aos-promote/aos-deferred-gap-acceptance.md"
  ],
  "authority_boundary": "P2_CONDITIONAL: AOS may be used as an internal governed subsystem. May not authorize, promote, close blocking debt, or claim production readiness.",
  "not_claimed": [
    "GatePromotionRecord is not production readiness",
    "P2_CONDITIONAL is not P3",
    "Promotion does not expand authority",
    "This is a retrospective dogfood submission"
  ]
}
